{
 "apps": [
  {
   "author": "why2025-linux contributors",
   "category": "hardware",
   "commands": [],
   "details_sha256": "7e2ea5273ace3461f9ec3ee47a27f5ba2a233c53e7f6a61bd9ea3edf36f5f9d9",
   "id": "buspirate",
   "install_location": "sd",
   "latest": {
    "build": 2,
    "package": {
     "installed_size": 530679,
     "sha256": "f8688e9c16d6b0f5687d2cc416d3f45e338a10ae8d2ff25153bb1cc02c30b2d6",
     "size": 235823,
     "url": "https://raw.githubusercontent.com/johndekroon/WhyOS-Apps/main/dist/v1/packages/buspirate-1.1.0.wpk"
    },
    "version": "1.1.0"
   },
   "menu_icon": "chip",
   "name": "Bus Pirate",
   "requires": {
    "features": [
     "usb-host",
     "display",
     "keyboard"
    ],
    "memory_kb": 1500,
    "os_api": 1
   },
   "summary": "Power supply, logic analyzer, LEDs and console for a Bus Pirate 6",
   "tags": [
    "bus-pirate",
    "logic-analyzer",
    "power-supply",
    "ws2812",
    "usb"
   ],
   "terminal": false,
   "type": "app",
   "updated": "2026-10-18"
  },
  {
   "author": "WhyOS-Apps contributors",
   "category": "tools",
   "commands": [],
   "details_sha256": "ad07a34c718583738e7baf05209537c6168f6080f4f48454962bf1f6107e646f",
   "id": "calc",
   "install_location": "sd",
   "latest": {
    "build": 2,
    "package": {
     "installed_size": 399059,
     "sha256": "0af1b0d3765f8196255544bf4450f34a34bbabfdaeaf1c4c078450c7bd131bc3",
     "size": 179678,
     "url": "https://raw.githubusercontent.com/johndekroon/WhyOS-Apps/main/dist/v1/packages/calc-1.1.0.wpk"
    },
    "version": "1.1.0"
   },
   "menu_icon": "count",
   "name": "Calculator",
   "requires": {
    "features": [
     "display",
     "keyboard"
    ],
    "memory_kb": 600,
    "os_api": 1
   },
   "summary": "Type a sum, get the answer: functions, hex and binary",
   "tags": [
    "calculator",
    "math",
    "hex",
    "binary"
   ],
   "terminal": false,
   "type": "app",
   "updated": "2026-10-18"
  },
  {
   "author": "id Software (DOOM), maximevince (fbDOOM), badge port",
   "category": "action",
   "commands": [],
   "details_sha256": "5d0cf3e94c31719cab274161c02105c9e321a44fea01252d36530ba074ec802c",
   "id": "doom",
   "install_location": "sd",
   "latest": {
    "build": 1,
    "package": {
     "installed_size": 4787534,
     "sha256": "bca984288c8797ebf0b88408e4b0c9af1714b09e31184c8b8ecc0447bbe05c6b",
     "size": 2031633,
     "url": "https://raw.githubusercontent.com/johndekroon/WhyOS-Apps/main/dist/v1/packages/doom-1.9.0.wpk"
    },
    "version": "1.9.0"
   },
   "menu_icon": "games",
   "name": "DOOM",
   "requires": {
    "features": [
     "sd-card",
     "display",
     "keyboard"
    ],
    "memory_kb": 6500,
    "os_api": 1
   },
   "summary": "The shareware episode of DOOM (1993), Knee-Deep in the Dead",
   "tags": [
    "doom",
    "fps",
    "shooter",
    "retro",
    "id-software"
   ],
   "terminal": false,
   "type": "game",
   "updated": "2026-10-12"
  },
  {
   "author": "gnuboy authors (rofl0r/gnuboy), badge port",
   "category": "emulators",
   "commands": [],
   "details_sha256": "cedd223c9b58e3d63320c8d3642649c199f2b30f3d203662483be8df1aea0c07",
   "id": "gnuboy",
   "install_location": "sd",
   "latest": {
    "build": 2,
    "package": {
     "installed_size": 415246,
     "sha256": "b09b9381691fab1acbf13f1cb1cf0d251f70b1b0e4be8d30a166bc4bf2a1ce70",
     "size": 202352,
     "url": "https://raw.githubusercontent.com/johndekroon/WhyOS-Apps/main/dist/v1/packages/gnuboy-1.1.0.wpk"
    },
    "version": "1.1.0"
   },
   "menu_icon": "gameboy",
   "name": "Game Boy",
   "requires": {
    "features": [
     "sd-card",
     "display",
     "keyboard"
    ],
    "memory_kb": 1000,
    "os_api": 1
   },
   "summary": "Game Boy and Game Boy Color emulator",
   "tags": [
    "emulator",
    "gameboy",
    "retro"
   ],
   "terminal": false,
   "type": "game",
   "updated": "2026-10-18"
  },
  {
   "author": "WhyOS-Apps contributors",
   "category": "tools",
   "commands": [],
   "details_sha256": "92217ea01edfd04c05e0e0a7c0532fbd7046d564a2d41a2ccc582a9ec9b32283",
   "id": "hideous",
   "install_location": "sd",
   "latest": {
    "build": 2,
    "package": {
     "installed_size": 362635,
     "sha256": "a4fe92620305566406a8030ea4a6a6c42742a3fad9e1a75e62ff280994826c35",
     "size": 156978,
     "url": "https://raw.githubusercontent.com/johndekroon/WhyOS-Apps/main/dist/v1/packages/hideous-1.0.1.wpk"
    },
    "version": "1.0.1"
   },
   "menu_icon": "keyboard",
   "name": "HIDeous",
   "requires": {
    "features": [
     "display",
     "keyboard"
    ],
    "memory_kb": 700,
    "os_api": 1
   },
   "summary": "HIDeous lets you control your computer using pre-recorded input from your badge.",
   "tags": [
    "keyboard",
    "mouse",
    "usb",
    "text",
    "typing"
   ],
   "terminal": false,
   "type": "app",
   "updated": "2026-10-20"
  },
  {
   "author": "badge port",
   "category": "other",
   "commands": [],
   "details_sha256": "fdc83c6ad5373dad679e3d1bc6b96fb4f2c97757bb974c79334e028adf783b24",
   "id": "imgview",
   "install_location": "sd",
   "latest": {
    "build": 2,
    "package": {
     "installed_size": 522481,
     "sha256": "1a90d1eb3bcc1d360014ec6f75cc87fde35c364710cf5ec87dbb0c02c483f6ad",
     "size": 266576,
     "url": "https://raw.githubusercontent.com/johndekroon/WhyOS-Apps/main/dist/v1/packages/imgview-1.1.0.wpk"
    },
    "version": "1.1.0"
   },
   "name": "Picture viewer",
   "requires": {
    "features": [
     "display",
     "keyboard"
    ],
    "memory_kb": 2500,
    "os_api": 1
   },
   "summary": "Shows JPEG and PNG pictures, opened from Files",
   "tags": [
    "photos",
    "pictures",
    "viewer",
    "jpeg",
    "png"
   ],
   "terminal": false,
   "type": "app",
   "updated": "2026-10-18"
  },
  {
   "author": "Twibright Labs (Links), badge port",
   "category": "internet",
   "commands": [
    "links"
   ],
   "details_sha256": "09ea4447c1e1b590123663119fbc714f9f27364cddaa208b73a3ee8ea16537e9",
   "id": "links",
   "install_location": "sd",
   "latest": {
    "build": 1,
    "package": {
     "installed_size": 3624215,
     "sha256": "54a8c27cf0d268dbd45f42417e903fe63e5ac544529e4a74da096d862dcd10b1",
     "size": 1895601,
     "url": "https://raw.githubusercontent.com/johndekroon/WhyOS-Apps/main/dist/v1/packages/links-1.0.0.wpk"
    },
    "version": "1.0.0"
   },
   "menu_icon": "globe",
   "name": "Links",
   "requires": {
    "features": [
     "wifi",
     "sd-card",
     "keyboard"
    ],
    "memory_kb": 4000,
    "os_api": 1
   },
   "summary": "Text web browser with HTTPS, for the terminal",
   "tags": [
    "browser",
    "web",
    "text",
    "terminal"
   ],
   "terminal": true,
   "type": "app",
   "updated": "2026-10-12"
  },
  {
   "author": "Damien P. George and the MicroPython contributors, badge port",
   "category": "tools",
   "commands": [
    "micropython",
    "python"
   ],
   "details_sha256": "559ce284b45050ae2dcf57351433cafb01e00548ef4916b8a2771839738b536e",
   "id": "micropython",
   "install_location": "sd",
   "latest": {
    "build": 1,
    "package": {
     "installed_size": 805927,
     "sha256": "3697117d59bc7562f0eb5788adae1f97654d8cf40e7d6337fed10d77ad23a320",
     "size": 446439,
     "url": "https://raw.githubusercontent.com/johndekroon/WhyOS-Apps/main/dist/v1/packages/micropython-1.29.0.wpk"
    },
    "version": "1.29.0"
   },
   "menu_icon": "terminal",
   "name": "MicroPython",
   "requires": {
    "features": [
     "sd-card",
     "keyboard"
    ],
    "memory_kb": 3000,
    "os_api": 1
   },
   "summary": "Python 3 on the badge: an interactive prompt and your own scripts",
   "tags": [
    "python",
    "micropython",
    "programming",
    "repl",
    "scripting",
    "terminal"
   ],
   "terminal": true,
   "type": "app",
   "updated": "2026-10-12"
  },
  {
   "author": "The GNU nano developers, badge port",
   "category": "tools",
   "commands": [
    "nano"
   ],
   "details_sha256": "993ef812116338c0b05e768ba211986e934e4c59a97581a7e429ce4b9a89c40e",
   "id": "nano",
   "install_location": "sd",
   "latest": {
    "build": 1,
    "package": {
     "installed_size": 659280,
     "sha256": "eb3e08dc79f41cd5e15e4076dc8b438bde3304bc4d135d6fcdc9c6275fb82059",
     "size": 335396,
     "url": "https://raw.githubusercontent.com/johndekroon/WhyOS-Apps/main/dist/v1/packages/nano-9.2.0.wpk"
    },
    "version": "9.2.0"
   },
   "menu_icon": "keyboard",
   "name": "nano",
   "requires": {
    "features": [
     "keyboard"
    ],
    "memory_kb": 1200,
    "os_api": 1
   },
   "summary": "A small, easy text editor",
   "tags": [
    "editor",
    "text",
    "terminal",
    "nano",
    "gnu"
   ],
   "terminal": true,
   "type": "app",
   "updated": "2026-10-12"
  },
  {
   "author": "The NetHack DevTeam, badge port",
   "category": "puzzle",
   "commands": [
    "nethack"
   ],
   "details_sha256": "4547b59e6b4b1e6771beac1d1042e306df46daeb2b2ae521777f893e4141e21b",
   "id": "nethack",
   "install_location": "sd",
   "latest": {
    "build": 2,
    "package": {
     "installed_size": 3439309,
     "sha256": "b024d416b50e5112eaf1cc63b6ed1cfca21efc3e0a2bb623d82bd93b4e6d918d",
     "size": 1631973,
     "url": "https://raw.githubusercontent.com/johndekroon/WhyOS-Apps/main/dist/v1/packages/nethack-3.6.7-2.wpk"
    },
    "version": "3.6.7-2"
   },
   "menu_icon": "games",
   "name": "NetHack",
   "requires": {
    "features": [
     "sd-card",
     "keyboard"
    ],
    "memory_kb": 2600,
    "os_api": 1
   },
   "summary": "The classic dungeon adventure: find the Amulet of Yendor",
   "tags": [
    "roguelike",
    "dungeon",
    "rpg",
    "terminal",
    "classic"
   ],
   "terminal": true,
   "type": "game",
   "updated": "2026-10-12"
  },
  {
   "author": "NetSurf developers, badge port",
   "category": "internet",
   "commands": [],
   "details_sha256": "be12d11f44e2b568d4e798b3bc480e4fafc7730a628284e72853f66f3f550605",
   "id": "netsurf",
   "install_location": "sd",